{
  "type": "voice.play",
  "session_id": "d0c7396f-b237-56dd-8be0-0bbffa7bd71e",
  "ts": "2026-10-01T14:03:22Z",
  "payload": {
    "text": "Heads up, Claude is making up sources.",
    "audio_b64": "SUQzBAAAAAAAI1RTU0UAAAAPAAADTGF2ZjU4Ljc2LjEwMAAAAAAAAAAAAAAA",
    "mime": "audio/mpeg",
    "level": 3
  }
}
